{
  "schema": "eip-8304-merge-fixture",
  "schema_version": 1,
  "status": "draft-pre-root",
  "eip_revision": "81b976ac01591fed2eecb73fa574f27cd18db2e8",
  "name": "merge-four-block-tables",
  "blocks": [
    {
      "block_number": "0x28",
      "parent_block_hash": "0x0000000000000000000000000000000000000000000000000000000000000000",
      "transactions": [
        {
          "hash": "0x4040404040404040404040404040404040404040404040404040404040404040"
        }
      ],
      "receipts": [
        {
          "logs": [
            {
              "address": "0xaaaaaaaaaaaaaaaaaaaaaaaaaaaaaaaaaaaaaaaa",
              "topics": [
                "0x0101010101010101010101010101010101010101010101010101010101010101"
              ]
            }
          ]
        }
      ]
    },
    {
      "block_number": "0x29",
      "parent_block_hash": "0x0000000000000000000000000000000000000000000000000000000000000000",
      "transactions": [
        {
          "hash": "0x4141414141414141414141414141414141414141414141414141414141414141"
        }
      ],
      "receipts": [
        {
          "logs": [
            {
              "address": "0xbbbbbbbbbbbbbbbbbbbbbbbbbbbbbbbbbbbbbbbb",
              "topics": [
                "0x0202020202020202020202020202020202020202020202020202020202020202"
              ]
            }
          ]
        }
      ]
    },
    {
      "block_number": "0x2a",
      "parent_block_hash": "0x0000000000000000000000000000000000000000000000000000000000000000",
      "transactions": [
        {
          "hash": "0x4242424242424242424242424242424242424242424242424242424242424242"
        }
      ],
      "receipts": [
        {
          "logs": [
            {
              "address": "0xaaaaaaaaaaaaaaaaaaaaaaaaaaaaaaaaaaaaaaaa",
              "topics": [
                "0x0303030303030303030303030303030303030303030303030303030303030303"
              ]
            }
          ]
        }
      ]
    },
    {
      "block_number": "0x2b",
      "parent_block_hash": "0x0000000000000000000000000000000000000000000000000000000000000000",
      "transactions": [
        {
          "hash": "0x4343434343434343434343434343434343434343434343434343434343434343"
        }
      ],
      "receipts": [
        {
          "logs": [
            {
              "address": "0xbbbbbbbbbbbbbbbbbbbbbbbbbbbbbbbbbbbbbbbb",
              "topics": [
                "0x0404040404040404040404040404040404040404040404040404040404040404"
              ]
            }
          ]
        }
      ]
    }
  ],
  "expected": {
    "per_block_l0": [
      {
        "encoded_entries_sorted": [
          "0x000000000000000000000000000000000000000000000000000000000000000000000000000000000027",
          "0x0001404040404040404040404040404040404040404040404040404040404040404000000000000000280000000000000000",
          "0x0002aaaaaaaaaaaaaaaaaaaaaaaaaaaaaaaaaaaaaaaa00000000000000280000000000000000",
          "0x0003010101010101010101010101010101010101010101010101010101010101010100000000000000280000000000000000"
        ],
        "entry_count": "0x4"
      },
      {
        "encoded_entries_sorted": [
          "0x000000000000000000000000000000000000000000000000000000000000000000000000000000000028",
          "0x0001414141414141414141414141414141414141414141414141414141414141414100000000000000290000000000000000",
          "0x0002bbbbbbbbbbbbbbbbbbbbbbbbbbbbbbbbbbbbbbbb00000000000000290000000000000000",
          "0x0003020202020202020202020202020202020202020202020202020202020202020200000000000000290000000000000000"
        ],
        "entry_count": "0x4"
      },
      {
        "encoded_entries_sorted": [
          "0x000000000000000000000000000000000000000000000000000000000000000000000000000000000029",
          "0x00014242424242424242424242424242424242424242424242424242424242424242000000000000002a0000000000000000",
          "0x0002aaaaaaaaaaaaaaaaaaaaaaaaaaaaaaaaaaaaaaaa000000000000002a0000000000000000",
          "0x00030303030303030303030303030303030303030303030303030303030303030303000000000000002a0000000000000000"
        ],
        "entry_count": "0x4"
      },
      {
        "encoded_entries_sorted": [
          "0x00000000000000000000000000000000000000000000000000000000000000000000000000000000002a",
          "0x00014343434343434343434343434343434343434343434343434343434343434343000000000000002b0000000000000000",
          "0x0002bbbbbbbbbbbbbbbbbbbbbbbbbbbbbbbbbbbbbbbb000000000000002b0000000000000000",
          "0x00030404040404040404040404040404040404040404040404040404040404040404000000000000002b0000000000000000"
        ],
        "entry_count": "0x4"
      }
    ],
    "merged_sorted": [
      "0x000000000000000000000000000000000000000000000000000000000000000000000000000000000027",
      "0x000000000000000000000000000000000000000000000000000000000000000000000000000000000028",
      "0x000000000000000000000000000000000000000000000000000000000000000000000000000000000029",
      "0x00000000000000000000000000000000000000000000000000000000000000000000000000000000002a",
      "0x0001404040404040404040404040404040404040404040404040404040404040404000000000000000280000000000000000",
      "0x0001414141414141414141414141414141414141414141414141414141414141414100000000000000290000000000000000",
      "0x00014242424242424242424242424242424242424242424242424242424242424242000000000000002a0000000000000000",
      "0x00014343434343434343434343434343434343434343434343434343434343434343000000000000002b0000000000000000",
      "0x0002aaaaaaaaaaaaaaaaaaaaaaaaaaaaaaaaaaaaaaaa00000000000000280000000000000000",
      "0x0002aaaaaaaaaaaaaaaaaaaaaaaaaaaaaaaaaaaaaaaa000000000000002a0000000000000000",
      "0x0002bbbbbbbbbbbbbbbbbbbbbbbbbbbbbbbbbbbbbbbb00000000000000290000000000000000",
      "0x0002bbbbbbbbbbbbbbbbbbbbbbbbbbbbbbbbbbbbbbbb000000000000002b0000000000000000",
      "0x0003010101010101010101010101010101010101010101010101010101010101010100000000000000280000000000000000",
      "0x0003020202020202020202020202020202020202020202020202020202020202020200000000000000290000000000000000",
      "0x00030303030303030303030303030303030303030303030303030303030303030303000000000000002a0000000000000000",
      "0x00030404040404040404040404040404040404040404040404040404040404040404000000000000002b0000000000000000"
    ],
    "merged_leaf_hashes": [
      "0x57d8ab1e5a2428ad9b051c937f7f977a31f55f4995b8488a71381568ec2c8b90",
      "0xe812fa776c767b02ac7d062353bece8fba36723e2a9867ee091d7fefd690d096",
      "0xdba412291670523eed2a9746de34cac2c9586951f08c95729cb29cecef5d728b",
      "0x9dc8f1bac98ddf3fff9434ec0b298b81c643155a6dcc6d025515ed7bb70bd40e",
      "0x8e2c7caad73f18f023a710894145963b0dc7c6fe50b37031189548939ff5a53a",
      "0x65bd0378fa37eb4183c79d1a9bec297f5d11be572c5ed9bd5ef31de21d3e8000",
      "0xe82f92821a056da1d58914b78fa544fe67dfc80fc67af75b8790e9b5849b42e6",
      "0x69ce68a82c5afe3f39f3a798003d747fda454bfb98b9ad8c07a9b8a438ad2b9b",
      "0x8e6aba1f0037c3d8ec333e349a782e20d35dc9d1dfe84858350cb8a4e5ff4648",
      "0x927a0247b5cc600e475c867719909b2291df1c84329ebce2dcb167ff647b7d8a",
      "0x2321aa53495e6d4ffe7b09395bbdd0b8cb39412047bd3389b2e17f9f6ea3e875",
      "0x9cdacfed0c88e99563da9cc861d4644777fd485254e651957b8490bc15c7af66",
      "0x144ba6ae13c228df2c4eb4f531c55a5218eba3bfaf26a7afbb93e442c059daf5",
      "0x77d242207f2bb36c3eaf955579108d2b8b1979133bac08ebc67322451ee2a152",
      "0x550f54c666c76cd45f54b9c45be452805d221cb78241657263ec9783e3ee2035",
      "0x044363661adf2ab86a7a1406e96bdcda3b6eb4fa7127aacd664d94ecc909e4a2"
    ],
    "merged_entry_count": "0x10"
  }
}
